{
  "$schema": "https://json-schema.org/draft/2020-12/schema",
  "title": "HFF theorem register v0.1",
  "type": "object",
  "additionalProperties": false,
  "required": [
    "schema_version",
    "status",
    "last_reviewed",
    "purpose",
    "non_goals",
    "required_fields",
    "confidence_scale",
    "source_class_scale",
    "source_class_promotion_rule",
    "theorems"
  ],
  "properties": {
    "schema_version": {"const": "theorem-register.v0.1"},
    "status": {"const": "docs-data-anchor"},
    "last_reviewed": {"type": "string", "pattern": "^\\d{4}-\\d{2}-\\d{2}$"},
    "purpose": {"type": "string", "minLength": 1},
    "non_goals": {"type": "array", "items": {"type": "string", "minLength": 1}, "uniqueItems": true, "minItems": 1},
    "required_fields": {"type": "array", "items": {"type": "string", "minLength": 1}, "uniqueItems": true, "minItems": 1},
    "confidence_scale": {"type": "object", "minProperties": 1, "additionalProperties": {"type": "string", "minLength": 1}},
    "source_class_scale": {
      "type": "object",
      "required": ["0", "1", "2", "3", "4", "5", "6"],
      "additionalProperties": false,
      "properties": {
        "0": {"type": "string", "minLength": 1},
        "1": {"type": "string", "minLength": 1},
        "2": {"type": "string", "minLength": 1},
        "3": {"type": "string", "minLength": 1},
        "4": {"type": "string", "minLength": 1},
        "5": {"type": "string", "minLength": 1},
        "6": {"type": "string", "minLength": 1}
      }
    },
    "source_class_promotion_rule": {"type": "string", "minLength": 1},
    "theorems": {
      "type": "array",
      "minItems": 1,
      "items": {
        "type": "object",
        "additionalProperties": true,
        "required": [
          "theorem_id",
          "title",
          "claim",
          "confidence",
          "source_class",
          "negative_tests",
          "pass_criteria",
          "fail_criteria",
          "human_risk_note",
          "last_reviewed",
          "next_safe_test",
          "repo_anchors"
        ],
        "properties": {
          "theorem_id": {"type": "string", "pattern": "^T\\d+$"},
          "title": {"type": "string", "minLength": 1},
          "claim": {"type": "string", "minLength": 1},
          "confidence": {"type": "number", "minimum": 0, "exclusiveMaximum": 1},
          "source_class": {"type": "array", "minItems": 1, "items": {"anyOf": [{"type": "integer", "minimum": 0, "maximum": 6}, {"type": "string", "minLength": 1}]}},
          "source_urls": {"type": "array", "items": {"type": "string", "minLength": 1}},
          "negative_tests": {"type": "array", "minItems": 1, "items": {"type": "string", "minLength": 1}},
          "pass_criteria": {"type": "array", "minItems": 1, "items": {"type": "string", "minLength": 1}},
          "fail_criteria": {"type": "array", "minItems": 1, "items": {"type": "string", "minLength": 1}},
          "human_risk_note": {"type": "string", "minLength": 1},
          "last_reviewed": {"type": "string", "pattern": "^\\d{4}-\\d{2}-\\d{2}$"},
          "next_safe_test": {"type": "string", "minLength": 1},
          "repo_anchors": {"type": "array", "minItems": 1, "items": {"type": "string", "minLength": 1}},
          "operational_proof": {"type": "boolean"}
        }
      }
    }
  }
}
