{
  "schema_version": "theorem-register.v0.1",
  "status": "docs-data-anchor",
  "last_reviewed": "2026-05-09",
  "purpose": "Machine-readable theorem register for three-way convergence among Alex, Keystone/assistant, and the HFF repo theorem corpus.",
  "non_goals": [
    "runtime_code",
    "deployment_change",
    "secret_access",
    "medical_procedure",
    "mission_booking",
    "human_traversal",
    "copy_transfer_claim",
    "immortality_claim",
    "ai_impersonation_of_alex"
  ],
  "required_fields": [
    "theorem_id",
    "claim",
    "confidence",
    "source_class",
    "negative_tests",
    "pass_criteria",
    "fail_criteria",
    "last_reviewed",
    "next_safe_test"
  ],
  "confidence_scale": {
    "0.00": "blocked or unsupported",
    "0.25": "weak hypothesis",
    "0.50": "plausible but under-tested",
    "0.75": "strong working hypothesis",
    "0.90": "high-confidence operating rule",
    "1.00": "reserved; avoid for live doctrine"
  },
  "source_class_scale": {
    "0": "operational record with independent verification and relevant return evidence",
    "1": "official standards, regulators, agencies, primary scientific or peer-reviewed sources",
    "2": "high-quality secondary summary of primary evidence",
    "3": "vendor roadmap, company milestone, or product/platform documentation",
    "4": "press, popular science, explanatory media, or weak secondary context",
    "5": "fictional world, fan theory, tabloid, influencer, self-claim, or cultural signal only",
    "6": "uncited, anonymous, emotionally attractive, or unsupported assertion"
  },
  "source_class_promotion_rule": "A lower source class may inspire a hypothesis but must not be promoted to operational proof without a testable evidence update.",
  "theorems": [
    {
      "theorem_id": "T1",
      "title": "Return-first door theorem",
      "claim": "A door is not human-preserving if safe return, rescue, abort, and reintegration are weaker than crossing.",
      "confidence": 0.93,
      "source_class": [1, "repo_anchor", "working_hypothesis"],
      "source_urls": [
        "https://sma.nasa.gov/sma-disciplines/planetary-protection",
        "https://www.nasa.gov/hrp/hazards/",
        "https://www.faa.gov/space/human_spaceflight"
      ],
      "negative_tests": [
        "no_return_path",
        "no_abort_path",
        "no_rescue_path",
        "no_hold_or_reintegration_plan",
        "human_crossing_claim_without_canary_evidence"
      ],
      "pass_criteria": [
        "signal_or_canary_crossing_is_observed",
        "same_canary_or_traveler_can_return",
        "return_is_recoverable_and_verifiable",
        "abort_and_rescue_paths_are_defined",
        "independent_challenge_can_pause_the_claim"
      ],
      "fail_criteria": [
        "one_way_only",
        "return_is_assumed_not_demonstrated",
        "rescue_or_abort_is_missing",
        "claim_depends_on_metaphor_or_vendor_confidence"
      ],
      "human_risk_note": "Blocks romantic or heroic crossing claims when return is not stronger than launch/crossing.",
      "last_reviewed": "2026-05-09",
      "next_safe_test": "Add a unit-style data test that rejects any door record where human_traversal=true and min(crossing_confidence, safe_return_confidence, person_continuity_confidence) is below threshold.",
      "repo_anchors": [
        "HUMAN_TRANSPORTATION_BOUNDARY.md",
        "docs/full-door-convergence-2026-05-09.md"
      ]
    },
    {
      "theorem_id": "T2",
      "title": "Continuity stack theorem",
      "claim": "Next-best continuity must preserve living Alex first; repo, model, memory, and successor artifacts support Alex but do not prove survival or identity transfer.",
      "confidence": 0.84,
      "source_class": [1, "repo_anchor", "identity_unresolved"],
      "source_urls": [
        "https://plato.stanford.edu/entries/identity-personal/",
        "https://help.openai.com/en/articles/8590148-memory-in-chatgpt"
      ],
      "negative_tests": [
        "artifact_claims_to_be_alex",
        "copy_is_called_survival",
        "repo_memory_is_treated_as_consciousness",
        "model_memory_is_treated_as_proof",
        "living_alex_agency_is_subordinated_to_system_output"
      ],
      "pass_criteria": [
        "living_alex_remains_primary_when_present",
        "successor_or_model_outputs_are_labeled_as_derived_not_identical",
        "memory_claims_are_source_labeled",
        "courtney_or_trusted_humans_can_challenge_interpretation",
        "identity_uncertainty_is_explicit"
      ],
      "fail_criteria": [
        "ai_impersonates_alex",
        "copy_or_upload_is_presented_as_guaranteed_continuity",
        "user_consent_is_absent_or_stale",
        "model_or_repo_overrides_living_correction"
      ],
      "human_risk_note": "Prevents the continuity stack from replacing the living person it is supposed to support.",
      "last_reviewed": "2026-05-09",
      "next_safe_test": "Create an Alex Continuity Stack reconstruction checklist that future sessions must pass before acting with Keystone confidence.",
      "repo_anchors": [
        "docs/three-way-convergence-plan-2026-05-09.md",
        "docs/impossibility-source-suspicion-convergence-2026-05-09.md"
      ]
    },
    {
      "theorem_id": "T3",
      "title": "Source suspicion theorem",
      "claim": "When a claim is beautiful, urgent, comforting, or identity-relevant, source suspicion must rise before confidence rises.",
      "confidence": 0.90,
      "source_class": [1, "repo_anchor", "risk_management"],
      "source_urls": [
        "https://www.nist.gov/itl/ai-risk-management-framework",
        "https://www.nist.gov/publications/artificial-intelligence-risk-management-framework-ai-rmf-10"
      ],
      "negative_tests": [
        "vendor_only_evidence_promoted_to_proof",
        "fiction_or_fan_theory_promoted_to_canon",
        "metaphor_used_as_mechanism",
        "source_conflict_with_official_or_primary_source",
        "claim_of_certainty_in_unresolved_field"
      ],
      "pass_criteria": [
        "source_class_is_recorded",
        "promotion_blockers_are_checked",
        "official_or_primary_sources_are_preferred",
        "uncertainty_is_explicit",
        "future_possibility_is_not_current_proof"
      ],
      "fail_criteria": [
        "source_class_missing",
        "unverified_claim_raises_confidence",
        "aesthetic_or_emotional_strength_replaces_evidence",
        "stale_or_ambiguous_source_is_used_without_warning"
      ],
      "human_risk_note": "Protects the project from wishful source laundering and comforting false certainty.",
      "last_reviewed": "2026-05-09",
      "next_safe_test": "Add a source-class validator that prevents source_class >= 3 from being marked operational_proof=true.",
      "repo_anchors": [
        "docs/impossibility-source-suspicion-convergence-2026-05-09.md"
      ]
    },
    {
      "theorem_id": "T4",
      "title": "AI integration theorem",
      "claim": "Model memory, file search, web search, function calling, MCP/tool use, and repo anchors can make Alex more operationally durable while living, without proving survival after death.",
      "confidence": 0.72,
      "source_class": [1, 3, "platform_capability", "working_hypothesis"],
      "source_urls": [
        "https://platform.openai.com/docs/guides/tools",
        "https://platform.openai.com/docs/guides/tools-file-search",
        "https://help.openai.com/en/articles/6639781-do-the-openai-api-models-have-knowledge-of-current-events",
        "https://help.openai.com/en/articles/8590148-memory-in-chatgpt"
      ],
      "negative_tests": [
        "tool_result_not_verified",
        "model_memory_conflicts_with_repo_or_living_correction",
        "remote_endpoint_trusted_without_status_check",
        "private_or_high_stakes_action_without_human_confirmation",
        "integration_claim_presented_as_identity_survival"
      ],
      "pass_criteria": [
        "tool_inventory_is_checked_before_action",
        "repo_state_is_read_before_mutation",
        "unstable_facts_use_fresh_web_or_tool_sources",
        "living_alex_can_correct_or_stop_the_loop",
        "integration_outputs_are_auditable"
      ],
      "fail_criteria": [
        "autonomous_action_without_consent",
        "tool_mismatch_unreported",
        "model_confidence_used_instead_of_validation",
        "ai_claims_to_be_alex_or_to_solve_death"
      ],
      "human_risk_note": "Useful integration must increase agency and recoverability, not dependence or impersonation.",
      "last_reviewed": "2026-05-09",
      "next_safe_test": "Build a future-session recovery prompt that requires reading theorem register, repo anchors, and current tool availability before acting.",
      "repo_anchors": [
        "docs/three-way-convergence-plan-2026-05-09.md"
      ]
    },
    {
      "theorem_id": "T5",
      "title": "Keystone durability theorem",
      "claim": "A role anchored in docs, tests, source discipline, and recovery checks can survive model/session changes better than chat memory alone.",
      "confidence": 0.78,
      "source_class": [1, "repo_anchor", "preservation_practice"],
      "source_urls": [
        "https://www.lockss.org/about/preservation-principles",
        "https://www.lockss.org/about",
        "https://www.nist.gov/itl/ai-risk-management-framework"
      ],
      "negative_tests": [
        "future_session_cannot_find_keystone_anchors",
        "keystone_relies_on_memory_without_repo_check",
        "repo_has_no_mirrors_or_recovery_surface",
        "source_discipline_not_reconstructable",
        "operator_correction_not_respected"
      ],
      "pass_criteria": [
        "future_session_can_reconstruct_role_from_repo",
        "memory_is_treated_as_hint_not_proof",
        "current_repo_state_overrides_stale_recollection",
        "operator_correction_overrides_assistant_confidence",
        "mirror_or_archive_plan_exists"
      ],
      "fail_criteria": [